notation,prefLabel,scopeNote
Abstract,Abstract,"A brief description of the resource and the context in which the resource was created."
Methods,Methods,"The methodology employed for the study or research."
SeriesInformation,Series Information,"Information about a repeating series, such as volume, issue, number."
TableOfContents,Table Of Contents,"A listing of the Table of Contents."
TechnicalInfo,Technical Info,"Detailed information that may be associated with design, implementation, operation, use, and/or maintenance of a process, system, or instrument."
Other,Other,"Other description information that does not fit into an existing category."